{"authority":"nxb-v11-compatibility-plan-v1","base":{"sha":"9203ab9f89ff4383832119683eb4e19df5490213","tree_sha":"241d3086e9bcb5a847445258cab25bff4fd34da8"},"candidate":{"branch":null,"pr_number":null,"sha":"aaaaaaaaaaaaaaaaaaaaaaaaaaaaaaaaaaaaaaaa","tree_sha":"bbbbbbbbbbbbbbbbbbbbbbbbbbbbbbbbbbbbbbbb"},"cell":{"axis":"baseline","axis_change_count":0,"baseline_cell_id":null,"cross_axis_exception_reference":null,"id":"win11-25h2-x64-ps76-py312-adk26100","status":"enabled","support_class":"primary"},"dispatcher":{"harness_manifest_sha256":"dddddddddddddddddddddddddddddddddddddddddddddddddddddddddddddddd","sha":"aaaaaaaaaaaaaaaaaaaaaaaaaaaaaaaaaaaaaaaa","tree_sha":"bbbbbbbbbbbbbbbbbbbbbbbbbbbbbbbbbbbbbbbb","workflow_blob_sha":"cccccccccccccccccccccccccccccccccccccccc"},"endurance":{"bounded_cycle_count":1,"tier":"1h"},"execution_mode":"admitted_main","intent":{"authority":"nxb-v11-compatibility-dispatch-intent-v1","runner_class":"nxb-native","sha256":"ffffffffffffffffffffffffffffffffffffffffffffffffffffffffffffffff"},"limits":{"observability":{"max_disk_bytes":536870912,"max_trace_post_seconds":30,"max_trace_pre_seconds":30,"max_trace_ring_bytes":67108864,"max_wpr_trigger_count":1},"runner":{"max_attempts_per_task":3,"max_ready_queue_depth":24,"max_ticks":256,"shards":4,"task_count":24},"transport":{"high_watermark":6,"low_watermark":2,"max_frame_bytes":16384,"max_queue_depth":8,"max_reconnect_attempts":3,"max_session_seconds":300,"max_spool_bytes":262144,"max_spool_records":64,"queue_overflow":0,"synthetic_event_count":24}},"lineage":{"a1_policy_enablement_receipt_sha256":"1111111111111111111111111111111111111111111111111111111111111111","a1_selector_preparation_receipt_sha256":"0000000000000000000000000000000000000000000000000000000000000000"},"policy":{"path":"config/nxb-v11-compatibility-policy.json","sha256":"eeeeeeeeeeeeeeeeeeeeeeeeeeeeeeeeeeeeeeeeeeeeeeeeeeeeeeeeeeeeeeee","status":"enabled"},"predecessor":{"issue":26,"main_sha":"9203ab9f89ff4383832119683eb4e19df5490213","main_tree_sha":"241d3086e9bcb5a847445258cab25bff4fd34da8","pr":48},"production_boundary":{"merge_mutation":false,"private_key_used":false,"release_mutation":false,"repository_protection_mutated":false,"tag_mutation":false},"repository":"Naveax/nxb-integrity-research-lab","review":{"entry_count":6},"schema_version":1}